,id,start_frame,stop_frame,annotation,video_file
0,0,90,102,spread margarine on two slices of white bread,video_0.mp4
1,1,114,127,place a slice of cheese on the bread,video_0.mp4
2,2,132,138,place the bread slices on top of each other and place in a hot pan,video_0.mp4
3,3,139,145,flip the sandwich over and press down,video_0.mp4
4,4,173,174,cut the sandwich in half diagonally,video_0.mp4
5,0,67,102,grill the  patties,video_4.mp4
6,1,129,157,chop some roasted pepper and season with salt and pepper,video_4.mp4
7,2,202,222,add butter flour and hot milk to a sauce pan and whisk,video_4.mp4
8,3,229,239,add some parmesan cheese and salt to pot,video_4.mp4
9,4,264,305,put the patties cheese sauce and vegetables in buns,video_4.mp4
10,0,77,98,mix sesame seeds with chicken breast,video_5.mp4
11,1,117,166,add in cooking oil soy sauce salt and mix everything up,video_5.mp4
12,2,175,193,add 2 tbsp corn starch and let it marinate,video_5.mp4
13,3,201,264,combine chicken stock dark soy sauce cooking wine hoisin sauce black vinegar sugar and sesame oil,video_5.mp4
14,4,269,319,mix some corn starch and water together,video_5.mp4
15,5,325,403,coat the chicken pieces with flour and fry them in the oil,video_5.mp4
16,6,513,579,fry some minced garlic roasted red chilli and the sauce,video_5.mp4
17,7,580,588,add in the corn starch and water mixture,video_5.mp4
18,8,600,618,add in the fried chicken and stir to coat them well,video_5.mp4
19,0,21,37,cut squid rings,video_6.mp4
20,1,57,67,add some ground white pepper ground cayenne pepper and ground black pepper to the same bowl,video_6.mp4
21,2,68,73,mix of ingredients in the bowl,video_6.mp4
22,3,74,79,coat the squid rings with the mixture in the bowl,video_6.mp4
23,4,80,100,put the squid rings on a pan and cook the squid rings with oil poured on them,video_6.mp4
24,0,16,23,heat some oil in a pan with garlic and cumin seeds,video_7.mp4
25,1,25,40,add some chopped onions and stir,video_7.mp4
26,2,67,109,add tomato puree and stir,video_7.mp4
27,3,131,158,add the chicken and coat with the sauce,video_7.mp4
28,4,168,197,season it with coriander powder and add some water,video_7.mp4
29,0,28,54,chop the lemon grass ginger onion and chili finely,video_9.mp4
30,1,55,80,pre heat oil in a bowl and add onions chili lemon grass ginger and garlic and stir it and put a lid on,video_9.mp4
31,2,81,123,discard the broken and bad mussels,video_9.mp4
32,3,129,144,add coconut milk fish sauce and soy sauce into the pan,video_9.mp4
33,4,161,165,chop fresh coriander and slice the lime,video_9.mp4
34,5,173,180,put all the mussels into the bowl and stir,video_9.mp4
35,6,196,210,transfer all the mussel shells out of the bowl and squeeze lemon over them,video_9.mp4
36,7,220,228,pour the sauce over the mussel shells,video_9.mp4
37,0,22,72,add cashews onion powder water and chicken flavoring to a blender and blend,video_10.mp4
38,1,74,80,pour the mixture on hash browns,video_10.mp4
39,2,87,112,mix the hash brown and the sauce,video_10.mp4
40,3,114,132,add the diced onions and mix,video_10.mp4
41,4,133,155,spread the mixture loosely on the cooking sheet with olive oil and place in the oven,video_10.mp4
42,0,24,27,chop green onions and garlic,video_11.mp4
43,1,28,58,add minced garlic brown sugar soy sauce rice wine sesame oil honey and ground black pepper to a bowl,video_11.mp4
44,2,62,75,cut the chicken and combine it with the marinade,video_11.mp4
45,3,78,89,oil a pan and place the chicken on it to cook,video_11.mp4
46,4,94,98,sprinkle the chicken with green onions and serve,video_11.mp4
47,0,68,90,cook some chicken pieces in a pan with some cooking oil,video_12.mp4
48,1,94,113,add some water taco seasoning mix and stir the chicken,video_12.mp4
49,2,122,150,put the chicken black beans green onions cilantro and pepper in the rice,video_12.mp4
50,3,151,187,mix the ingredients,video_12.mp4
51,4,211,262,place the filling and cheese on the tortilla and roll the burrito,video_12.mp4
52,0,32,100,put the thinly sliced cabbage in a jar,video_13.mp4
53,1,105,141,add sugar salt and vinegar to the jar,video_13.mp4
54,2,150,207,fill the jar with boiling water and place the lid on the jar,video_13.mp4
55,0,135,175,trim fat from pork and cut it to slices,video_14.mp4
56,1,176,179,season with a little salt and pepper,video_14.mp4
57,2,180,209,cut one green onion into 1 inch size,video_14.mp4
58,3,214,225,cut a red onion into strips,video_14.mp4
59,4,226,242,chop a chinese broccoli to half inch pieces,video_14.mp4
60,5,245,267,cut the mushroom into thin slices,video_14.mp4
61,6,274,290,combine soy sauce water and sugar in a bowl,video_14.mp4
62,7,299,323,boil some udon noodles in water,video_14.mp4
63,8,345,362,boil the chinese broccoli and drain it,video_14.mp4
64,9,372,411,fry the pork with oil and the green onion red onion carrot mushroom and chinese broccoli,video_14.mp4
65,10,412,419,add the udon noodles and cook,video_14.mp4
66,11,425,449,add the premade sauce and stir,video_14.mp4
67,0,43,72,add onion chilis garlic and lemon grass to the food processor,video_15.mp4
68,1,84,110,add shrimp paste cloves tumeric and curry powder to the food processor,video_15.mp4
69,2,141,190,add oil to the food processor while blending,video_15.mp4
70,3,200,228,blend the ingredients in the food processor,video_15.mp4
71,4,274,286,stir the curry paste,video_15.mp4
72,0,47,80,fry oil onions herbs and vegetables in a pan,video_16.mp4
73,1,81,89,pour water into the pan,video_16.mp4
74,2,90,97,mix everything and let it cook,video_16.mp4
75,3,98,126,add potatoes cabbage and pasta to the pan and stir,video_16.mp4
76,4,129,173,add flour mixture tomatoes herbs and seasoning to the pan and stir,video_16.mp4
77,5,182,187,garnish with parsley,video_16.mp4
78,0,85,114,cut tofu into strips,video_17.mp4
79,1,120,202,add oil ginger bean paste chilli paste mushroom green onion chicken lily and vegetable stock to a pot,video_17.mp4
80,2,225,304,add soy sauce vinegar black pepper and sliced tofu,video_17.mp4
81,3,338,365,add cornstarch and water and stir,video_17.mp4
82,4,375,395,add egg and sesame oil,video_17.mp4
83,0,72,82,add baking powder salt and flour to a bowl and mix,video_18.mp4
84,1,85,98,add melted butter yogurt minced garlic coriander leaves to the bowl and mix,video_18.mp4
85,2,99,112,add water to the bowl and knead the dough,video_18.mp4
86,3,113,140,sprinkle dry flour and knead the dough,video_18.mp4
87,4,160,166,wrap the dough in plastic wrap,video_18.mp4
88,5,235,293,roll a ball of dough into a thin shape,video_18.mp4
89,6,317,333,pat the naan with water and place on a hot pan,video_18.mp4
90,7,343,346,flip the naan to the other side and cover the lid,video_18.mp4
91,8,352,358,remove the naan from the pan place in a plate and rub butter on it,video_18.mp4
92,0,21,33,add the lobster to a pan,video_19.mp4
93,1,58,67,pour eggs on the lobster,video_19.mp4
94,2,73,150,move the eggs in the pan,video_19.mp4
95,3,152,170,place the scrambled eggs on a plate with toast,video_19.mp4
96,0,24,38,rinse the quinoa with water,video_20.mp4
97,1,41,57,add quinoa water and salt to a pot,video_20.mp4
98,2,71,82,slice and dice the ham into cubes,video_20.mp4
99,3,101,137,fry the ham peppers and onions in a pan,video_20.mp4
100,4,140,147,add garlic to the pan,video_20.mp4
101,5,175,186,add the quinoa the the pan,video_20.mp4
102,6,195,216,add rice vinegar soy sauce and sriracha to the pan,video_20.mp4
103,7,221,231,add green onion to the pan,video_20.mp4
104,0,14,20,put chopped green onions in a bowl,video_21.mp4
105,1,32,41,blend some pear with garlic,video_21.mp4
106,2,43,61,add brown sugar to the green onion,video_21.mp4
107,3,70,117,combine soy sauce mirin rice vinegar and honey,video_21.mp4
108,4,120,127,add some ground pepper to the green onions,video_21.mp4
109,5,130,150,pour the combined liquid and the blended pear to the green onion bowl,video_21.mp4
110,6,153,161,stir the ingredients,video_21.mp4
111,7,164,170,pour in a little sesame oil,video_21.mp4
112,8,191,213,marinate the beef,video_21.mp4
113,9,226,256,cook the marinated beef on a pan,video_21.mp4
114,0,35,52,put cake flour sugar corn starch baking powder and salt in a bowl and sift them together,video_22.mp4
115,1,53,57,mix the bowl well with a whisk,video_22.mp4
116,2,58,62,beat one egg in a bowl,video_22.mp4
117,3,63,69,add milk to the bowl and mix well,video_22.mp4
118,4,71,86,add the dry ingredients and mix until well blended,video_22.mp4
119,5,87,93,add cooking oil and mix the bowl,video_22.mp4
120,6,94,97,cover the bowl with plastic wrap,video_22.mp4
121,7,100,104,heat a nonstick pan over medium heat,video_22.mp4
122,8,105,115,place the pan on a wet towel turn off the stove and place the pan back on the stove,video_22.mp4
123,9,116,123,pour the batter onto the pan,video_22.mp4
124,10,124,132,flip the pancake when bubbles appear,video_22.mp4
125,11,133,136,cook until the other side of the pancake is brown,video_22.mp4
126,12,139,142,place a piece of butter on the pancakes and pour some maple syrup,video_22.mp4
127,0,30,36,mix 3 types of flour to a bowl,video_23.mp4
128,1,37,54,add 1 egg 1/2 cup of water salt and sugar and mix,video_23.mp4
129,2,57,68,cut an onion to rings,video_23.mp4
130,3,83,97,coat the onion rings in the liquid mixture and then in bread crumb,video_23.mp4
131,4,103,130,fry the onion rings in shallow oil,video_23.mp4
132,0,24,30,add oil chopped onion garlic and salt to a pan,video_24.mp4
133,1,53,60,add the lamb to the pan and mix,video_24.mp4
134,2,126,130,add a small bowl of flour to the lamb,video_24.mp4
135,3,132,149,add worcester sauce tomato puree beef stock and water to the pan,video_24.mp4
136,4,153,157,add thyme to the pan,video_24.mp4
137,5,206,215,add carrots and diced swede to the pan,video_24.mp4
138,6,236,247,add mashed potatoes on top of the lamb,video_24.mp4
139,7,256,259,place the pan into an oven,video_24.mp4
140,0,40,62,place pieces of pork shoulder dark and light soy sauce chinese rice wine cinnamon sticks and water to a pot,video_25.mp4
141,1,63,85,boil and remove the foam,video_25.mp4
142,2,95,106,add vinegar sugar and salt to a bowl and mix,video_25.mp4
143,3,108,120,add carrot and daikon to the bowl and stir,video_25.mp4
144,4,142,150,add sugar to the pork and stir,video_25.mp4
145,5,154,162,add the pork simmering liquid and fish sauce to a bowl,video_25.mp4
146,6,167,173,drain the carrot and daikon pickle,video_25.mp4
147,7,178,190,slice the pork into thin slices,video_25.mp4
148,8,198,209,slice a baguette lengthwise and spread mayonnaise,video_25.mp4
149,9,213,231,spread pate on the bread,video_25.mp4
150,10,235,295,add lettuce leaves pickled vegetables cucumber scallions cilantro jalapeno and pork to the bread,video_25.mp4
151,11,297,301,add the simmering mixture and fish sauce to the sandwich,video_25.mp4
152,12,314,318,add pork floss to the sandwich,video_25.mp4
153,0,136,152,boil chick peas in pressure cooker with ginger,video_26.mp4
154,1,178,198,add oil and green chilies to pan,video_26.mp4
155,2,208,230,remove chilies and add cumin seeds and chick pea flour,video_26.mp4
156,3,240,264,add blended tomatoes to pan and stir,video_26.mp4
157,4,274,284,add coriander powder black salt and green chilis,video_26.mp4
158,5,298,304,add salt and black salt,video_26.mp4
159,6,307,324,add chick peas to pan and cover,video_26.mp4
160,7,345,364,add ground masala machu powder and water,video_26.mp4
161,0,5,78,mix the maida rice flour suji curry leaves salt cumin seeds and hing,video_27.mp4
162,1,78,114,add the water ginger and chilis to the mixture,video_27.mp4
163,2,130,150,add black pepper and grated coconut,video_27.mp4
164,3,155,162,add milk to the dough,video_27.mp4
165,4,190,205,spread the batter in the pan,video_27.mp4
166,5,218,228,add oil to the edges,video_27.mp4
167,6,228,235,flip the dosa over,video_27.mp4
168,7,244,256,place the potato mixture on the dosa,video_27.mp4
169,8,256,263,fold the dosa over,video_27.mp4
170,0,50,71,chop a big cabbage,video_28.mp4
171,1,78,112,heat a pan with oil and saute the chopped cabbage,video_28.mp4
172,2,114,150,add some cider vinegar and saute the cabbage,video_28.mp4
173,3,151,203,add salt ground mustard seed brown sugar and stir,video_28.mp4
174,0,58,68,chop a stalk of parsley,video_29.mp4
175,1,69,85,finely chop a few cloves of garlic,video_29.mp4
176,2,89,100,finely chop a few hot peppers,video_29.mp4
177,3,124,139,cut a stick of butter into thin slices and add to the vegetables,video_29.mp4
178,4,140,180,add salt black pepper and breadcrumbs to the bowl and mix together,video_29.mp4
179,5,181,208,add the butter mixture to empty shells,video_29.mp4
180,6,217,224,add the escargot inside the shells,video_29.mp4
181,7,225,230,put the butter mixture on top of the escargot,video_29.mp4
182,8,283,290,dip an escargot into the breadcrumbs,video_29.mp4
183,9,314,338,pour some water into a tray and place the escargot onto it and place in the oven,video_29.mp4
184,10,355,379,remove the escargot from the oven and place on a plate,video_29.mp4
185,11,395,408,place pieces of garlic bread on the plate with the escargot,video_29.mp4
186,0,78,100,combine chilies black pepper coriander cumin fenugreek seeds cardamom and a cinnamon stick and blend into a powder,video_30.mp4
187,1,101,119,add chopped garlic chopped ginger and chopped onion,video_30.mp4
188,2,121,124,add white vinegar and brown vinegar and mix,video_30.mp4
189,3,128,136,add brown sugar salt paprika and canned tomatoes,video_30.mp4
190,4,144,158,add the spice powder to it and blend,video_30.mp4
191,5,159,166,heat up a pot on the grill with ghee and lamb,video_30.mp4
192,6,167,195,pour in the sauce stir and cover the pot,video_30.mp4
193,7,198,214,open the lid stir close the lid and move the pot from the direct heat,video_30.mp4
194,8,220,222,cover the grill and cook,video_30.mp4
195,9,224,236,stir the pot,video_30.mp4
196,10,239,245,replace the lid on the grill and cook,video_30.mp4
197,0,25,40,trim the fat off of some beef and place in a slow cooker,video_31.mp4
198,1,41,53,crush caraway seeds with a mortar and pastel and pour into a small bowl,video_31.mp4
199,2,54,64,add paprika salt and pepper to the caraway seeds,video_31.mp4
200,3,65,73,sprinkle the spices over the beef cubes and stir,video_31.mp4
201,4,77,89,add a large onion and bell pepper to the beef,video_31.mp4
202,5,92,114,add diced tomatoes beef broth worcester sauce and minced garlic to a pan and stir,video_31.mp4
203,6,115,129,pour the tomatoes into the slow cooker and place two bay leaves on top,video_31.mp4
204,7,131,139,turn on the slow cooker on high for four hours,video_31.mp4
205,8,152,164,mix corn starch and water in a bowl and stir with the stew,video_31.mp4
206,0,48,65,cook the meat in a pan,video_33.mp4
207,1,67,74,cook the spinach in a steamer,video_33.mp4
208,2,80,95,cook the mushrooms in a pan,video_33.mp4
209,3,103,115,cook the bean sprouts in a pan,video_33.mp4
210,4,121,132,cook the carrots in a pan,video_33.mp4
211,5,135,172,combine gochujang soy sauce vinegar sesame seeds oil garlic and honey,video_33.mp4
212,6,203,231,blend cilantro garlic lime juice and oil,video_33.mp4
213,7,233,241,poach the egg in water,video_33.mp4
214,8,248,313,place the bean sprouts cucumber carrots mushrooms spinach and meat on the rice,video_33.mp4
215,9,324,345,add cilantro and gochujang sauce,video_33.mp4
216,10,348,365,place the egg on top,video_33.mp4
217,0,61,83,place chicago hot dogs on the grills and cook for few minutes,video_34.mp4
218,1,129,133,remove the cooked sausages on a plate,video_34.mp4
219,2,167,173,put hot water in bowl place sieve on put poppy seed buns inside cover with towel to make buns softer,video_34.mp4
220,3,181,197,cut the buns place the grilled dogs inside squeeze some mustard sauce on it,video_34.mp4
221,4,199,219,now spread green relish and then add chopped white onions on it,video_34.mp4
222,5,220,239,place slices of tomato in the edges and pickle and 2 pepper on top,video_34.mp4
223,6,244,246,lastly top with celery salt and serve,video_34.mp4
224,0,13,128,cut the pineapple,video_35.mp4
225,1,134,209,pound the garlic and chop it mince the ginger and slice the scallions,video_35.mp4
226,2,210,220,pour a little bit of vegetable oil in a pan,video_35.mp4
227,3,224,265,add ginger garlic and rice into the pan and stir it,video_35.mp4
228,4,267,305,add the shrimp pineapple and scallion and stir,video_35.mp4
229,5,310,338,transfer the rice into the pineapple bowl and garnish with cilantro,video_35.mp4
230,0,0,22,chop the potatoes,video_36.mp4
231,1,29,34,add water and lentils to the pot,video_36.mp4
232,2,35,39,add the chopped potatoes to a pot,video_36.mp4
233,3,45,53,boil the potatoes and lentils,video_36.mp4
234,4,56,61,drain the lentils,video_36.mp4
235,5,62,74,add broccoli and red bell pepper,video_36.mp4
236,6,76,91,add some fennel seeds and mixed herbs,video_36.mp4
237,7,98,110,add some onion powder and tomato sauce,video_36.mp4
238,8,111,114,add chopped carrots,video_36.mp4
239,9,128,139,add nutritional yeast and stir,video_36.mp4
240,10,142,147,add the cooked lentils to the soup,video_36.mp4
241,0,78,92,mix water salt and sugar,video_37.mp4
242,1,94,104,soak the salmon in the brine,video_37.mp4
243,2,121,127,add olive oil and the fish to a bag,video_37.mp4
244,3,153,175,cook the salmon in the bag,video_37.mp4
245,4,182,248,separate the salmon into pieces,video_37.mp4
246,5,262,271,spread the soy air on the plate,video_37.mp4
247,6,271,292,place the avocado and salmon on the plate,video_37.mp4
248,0,32,39,open the can of chickpeas and drain,video_39.mp4
249,1,43,58,chop up garlic in a food processor,video_39.mp4
250,2,58,106,add chickpeas lemon juice olive oil and water to food processor and blend,video_39.mp4
251,3,106,126,add black pepper and salt and stir,video_39.mp4
252,0,13,38,add flour pepper and salt to a bowl and mix,video_41.mp4
253,1,39,60,add the chicken and cover with flour,video_41.mp4
254,2,60,137,add barbecue sauce honey onion powder hickory seasoning to another bowl and mix together,video_41.mp4
255,3,153,171,add the chicken to the fryer,video_41.mp4
256,4,171,206,put the chicken into bowl of sauce and mix,video_41.mp4
257,0,24,36,heat pan with oil and add garlic paste,video_44.mp4
258,1,37,56,add green chili and coriander seeds cook on medium heat,video_44.mp4
259,2,58,75,add chopped onions and fry until brown,video_44.mp4
260,3,78,96,add red chili powder red chili flakes and mix well,video_44.mp4
261,4,97,112,add one cup of water,video_44.mp4
262,5,113,121,add some salt and mashed potatos,video_44.mp4
263,6,132,152,mix flour salt and oil in a bowl adding water slowly to form a dough,video_44.mp4
264,7,154,188,make small rolls of dough and roll into circle and cut in half,video_44.mp4
265,8,189,240,fold into cone shape and fill with potato mix and pinch top closed,video_44.mp4
266,9,241,261,heat oil in pot and deep fry then serve,video_44.mp4
267,0,12,16,add water to rice,video_45.mp4
268,1,20,30,drain the water and boil it in pressure cooker,video_45.mp4
269,2,20,55,add olive oil lemon juice salt and rice,video_45.mp4
270,3,60,74,add the lid and cook the rice,video_45.mp4
271,4,108,127,add spices to the chicken,video_45.mp4
272,5,127,135,mix the chicken,video_45.mp4
273,6,145,155,put chicken pieces onto frying pan,video_45.mp4
274,7,170,175,put lid on the frying pan,video_45.mp4
275,8,190,197,beat one egg in a bowl,video_45.mp4
276,9,200,221,add ginger garlic and onions,video_45.mp4
277,10,290,296,add the fried chicken pieces to the pan,video_45.mp4
278,11,301,312,add soy sauce and chili garlic sauce,video_45.mp4
279,12,330,341,add the cooked rice,video_45.mp4
280,13,352,381,add pepper vinegar and salt,video_45.mp4
281,0,78,85,soak chickpeas with water,video_46.mp4
282,1,98,123,drain and blend the chickpeas,video_46.mp4
283,2,138,157,add parsley coriander chili garlic and some blended chickpeas to the blender,video_46.mp4
284,3,160,162,blend the ingredients,video_46.mp4
285,4,165,169,mix the blended mixture with the blended chickpeas,video_46.mp4
286,5,172,189,add flour cumin crushed coriander seeds baking soda and a little salt and pepper,video_46.mp4
287,6,190,194,mix all the ingredients,video_46.mp4
288,7,201,209,heat some oil in a pan,video_46.mp4
289,8,210,220,form the falafel balls,video_46.mp4
290,9,236,245,add the falafel balls to the oil,video_46.mp4
291,10,255,263,remove the balls and drain with paper towel,video_46.mp4
292,0,21,24,heat the pan,video_47.mp4
293,1,25,34,crack an egg into the bowl,video_47.mp4
294,2,39,43,add oil to the pan,video_47.mp4
295,3,44,56,pour the egg and add a pinch of salt and red chili powder,video_47.mp4
296,4,57,77,add some chopped chilies some chopped tomatoes chopped coriander leaves and some grated cheese,video_47.mp4
297,5,78,95,flip the egg and cook the other side,video_47.mp4
298,6,106,109,place the cooked egg on toast,video_47.mp4
299,0,60,74,heat up a bowl of shredded cabbage and water drain it run under cold water and remove excess water,video_48.mp4
300,1,75,81,add green onion garlic ginger sugar shaoxing wine soy sauce and corn starch to a bowl of ground beef,video_48.mp4
301,2,82,85,mix the bowl of ground beef by hand,video_48.mp4
302,3,88,93,add the cabbage to the beef and mix by hand,video_48.mp4
303,4,94,102,wet the edges of a potsticker,video_48.mp4
304,5,103,140,add the meat mixture to the center of the wrapper fold in half and close,video_48.mp4
305,6,144,154,add peanut oil to a pan and spread,video_48.mp4
306,7,155,164,add the potstickers to the pan and pour hot water over them,video_48.mp4
307,0,20,31,grate the potato and onion,video_49.mp4
308,1,37,43,squeeze water out of the potatos with a towel,video_49.mp4
309,2,46,63,mix an egg salt and pepper with the potatos,video_49.mp4
310,3,63,79,mix flour with the potato mixture,video_49.mp4
311,4,80,88,add oil to a pan,video_49.mp4
312,5,94,108,place dollops of batter onto the pan and flatten,video_49.mp4
313,6,108,111,flip the pancakes when the edges turn brown,video_49.mp4
314,0,75,87,ground some roasted peanuts and put aside,video_50.mp4
315,1,177,222,add cooking oil in a pan and cook the tofu chunks in it,video_50.mp4
316,2,249,278,add 1 clove of chopped garlic and 1 small chopped shallot after tofu turns brown,video_50.mp4
317,3,292,329,add some soaked rice noodles and add water to soften it,video_50.mp4
318,4,340,343,add pad thai sauce,video_50.mp4
319,5,354,362,add sugar and fish sauce,video_50.mp4
320,6,389,431,add some shrimp and bean sprouts and continue stirring,video_50.mp4
321,7,452,477,add cooking oil and beat an egg,video_50.mp4
322,8,492,501,put the grounded peanuts on top of the noodles,video_50.mp4
323,0,140,151,combine seasoned bread crumbs with flour,video_51.mp4
324,1,152,167,beat an egg and dip the chicken in it,video_51.mp4
325,2,173,188,coat the chicken with the bread crumb powder and lay them on a baking pan,video_51.mp4
326,3,228,255,spread some salt black pepper and butter on each piece of chicken,video_51.mp4
327,4,334,382,bake the chicken in the oven,video_51.mp4
328,0,44,48,boil a pot of water,video_52.mp4
329,1,50,67,add an egg oil vinegar to a bowl and mix,video_52.mp4
330,2,73,80,place the bowl above the boiling water,video_52.mp4
331,3,87,92,place pieces of bread in an oven,video_52.mp4
332,4,104,109,poach an egg and place onto paper towel,video_52.mp4
333,5,110,138,place bacon and egg onto the bread and top with the sauce,video_52.mp4
334,0,90,132,add flour salt and oil and mix into a dough,video_54.mp4
335,1,156,205,add oil cumin seeds ginger garlic green chilies turmeric powder green peas and water,video_54.mp4
336,2,207,219,cook with the lid and add salt,video_54.mp4
337,3,236,258,add the mashed potatoes and garam masala and mix,video_54.mp4
338,4,269,282,add in the dry mango powder and chopped coriander leaves,video_54.mp4
339,5,331,360,roll and cut the dough,video_54.mp4
340,6,368,491,apply water to the edges make a cone stuff it with the filling and seal it,video_54.mp4
341,7,499,539,heat oil in a pan and deep fry the samosas,video_54.mp4
342,0,5,8,add eggs to a bowl and whisk,video_56.mp4
343,1,8,14,add milk garlic powder salt and pepper,video_56.mp4
344,2,15,17,spread butter on the dish,video_56.mp4
345,3,17,21,add pieces of english muffin and ham to the dish,video_56.mp4
346,4,21,25,pour the egg mixture over the dish,video_56.mp4
347,5,27,29,bake the dish in the oven,video_56.mp4
348,6,30,34,mix egg yolks and lemon juice,video_56.mp4
349,7,36,47,mix butter cayenne pepper and salt with the sauce,video_56.mp4
350,8,47,51,pour the sauce over the dish,video_56.mp4
351,9,51,54,sprinkle paprika and parsley on top,video_56.mp4
352,0,47,52,place a skillet of sausages on the grill,video_57.mp4
353,1,58,68,cover the grill and cook the sausges,video_57.mp4
354,2,69,104,flip the bratwursts over,video_57.mp4
355,3,128,137,place the sausages on the grill,video_57.mp4
356,0,43,68,put maida in a deep bowl add sooji baking soda salt and mix well,video_58.mp4
357,1,71,86,add yogurt and mix well,video_58.mp4
358,2,84,98,add water and start to knead in to stiff dough,video_58.mp4
359,3,101,142,once dough is ready cover and keep it to rest for 4 hours,video_58.mp4
360,4,160,181,heat up oil add cumin seeds onion and cook until onion gets golden brown,video_58.mp4
361,5,185,200,add ginger garlic paste and cook,video_58.mp4
362,6,205,236,add chana masala and cook for 2 minutes,video_58.mp4
363,7,243,270,add tomatoes red chilli powder mix cover and cook for 5 minutes,video_58.mp4
364,8,294,348,add soaked chana salt water cover and pressure cook,video_58.mp4
365,9,381,405,after 4 hours divide dough in small balls,video_58.mp4
366,10,420,461,deep fry until gets golden color from both sides,video_58.mp4
367,0,53,102,peel and cut the radish,video_59.mp4
368,1,103,110,wash the radish,video_59.mp4
369,2,115,130,spread salt onto the radish,video_59.mp4
370,3,189,193,drain and rinse the radish,video_59.mp4
371,4,196,213,mix red chili sugar garlic fish sauce and scallians with the radish,video_59.mp4
