,id,start_frame,stop_frame,annotation,video_file
2475,5,150,181,remove from pan and place into toasted bread,video_416.mp4
2476,6,182,237,garnish with lemon grass butter and basil oil and fresh basil,video_416.mp4
2477,0,9,10,put the flour in a bowl and add a little water at a time,video_417.mp4
2478,1,10,14,bring the flour together with your hands to make the dough,video_417.mp4
2479,2,23,24,put some dry flour on a flat plate for dusting,video_417.mp4
2480,3,24,26,get flour on your hands and take a tangerine-sized ball of dough,video_417.mp4
2481,4,28,32,roll the dough in the palms of your hands creating a smooth ball,video_417.mp4
2482,5,33,37,flatten it using the fingers,video_417.mp4
2483,6,37,50,flour again and begin to roll out,video_417.mp4
2484,7,52,56,heat the pan and carefully place the roti flat on to it,video_417.mp4
2485,8,61,64,use tongs and move it around so it doesn't burn,video_417.mp4
2486,9,64,74,turn the heat down a little and when bubbles appear and turn the roti over,video_417.mp4
2487,10,76,82,remove the roti and set it on a clean tea towel and cover to keep warm,video_417.mp4
2488,0,49,55,add some oatmeal to ground turky meat,video_419.mp4
2489,1,55,119,add an egg parsley and minced garlic and mix it,video_419.mp4
2490,2,123,159,add some ground carrots salt and pepper,video_419.mp4
2491,3,170,200,scoop the mixture on a baking sheet,video_419.mp4
2492,4,207,212,cook them in an oven,video_419.mp4
2493,0,20,47,mix plain yogurt chopped cucumber fresh dill salt and black pepper,video_421.mp4
2494,1,48,58,add mayonnaise and stir,video_421.mp4
2495,2,59,71,add drained chickpeas into a bowl and mash them,video_421.mp4
2496,3,72,83,add chopped onion parsley and chopped garlic cloves to a food processor and blend it until smooth,video_421.mp4
2497,4,85,90,stir the paste into the mashed chickpeas,video_421.mp4
2498,5,91,106,mix together egg ground cumin ground coriander salt lemon juice and baking powder,video_421.mp4
2499,6,111,125,add black pepper and cayenne pepper and stir in with the chickpeas,video_421.mp4
2500,7,127,141,add olive oil and bread crumbs and mix together,video_421.mp4
2501,8,142,157,shape the mixture into patties,video_421.mp4
2502,9,165,184,fry the falafel,video_421.mp4
2503,10,187,192,spread the cucumber sauce on the falafel,video_421.mp4
2504,0,73,140,mix pork scallions oyster sauce salt oil and soy sauce,video_423.mp4
2505,1,169,174,place the filling on the center of the wrapper,video_423.mp4
2506,2,185,205,fold the wanton in half and press the edges together,video_423.mp4
2507,3,265,284,add the noodles to the pot of boiling water,video_423.mp4
2508,4,302,330,add the bok choy to the pot,video_423.mp4
2509,5,358,381,chop up a spring onion,video_423.mp4
2510,6,395,425,add the noodles and soup to the bowl,video_423.mp4
2511,7,425,466,add the spring onions sesame oil and the wontons to the soup,video_423.mp4
2512,0,147,176,add sugar angostura bitters orange bitters and bourbon to a glass,video_425.mp4
2513,1,176,189,add ice cubes to the glasses,video_425.mp4
2514,2,191,221,cut small pieces off the orange rind and add to the glass,video_425.mp4
2515,3,372,385,coat the chicken with olive oil salt and pepper,video_425.mp4
2516,4,402,415,add oil garlic shallots basil and oregano to a pot,video_425.mp4
2517,5,422,440,add the tomatoes and tomato paste to the pot,video_425.mp4
2518,6,443,453,add the vodka and cream to the sauce,video_425.mp4
2519,7,483,500,place the chicken in a pan and cover,video_425.mp4
2520,8,519,544,add the sauce with pasta and sliced chicken to a plate and garnish with cheese,video_425.mp4
2521,0,69,83,cook the tomatos in the oven,video_426.mp4
2522,1,102,115,add the garlic to the pot,video_426.mp4
2523,2,146,154,pour in stock,video_426.mp4
2524,3,160,184,add pureed tomatos salt and pepper to the pot,video_426.mp4
2525,4,199,201,pour in a can of water,video_426.mp4
2526,5,249,257,add basil leaves to the soup,video_426.mp4
2527,6,325,328,add the cooked tomatos,video_426.mp4
2528,7,415,450,blend the soup,video_426.mp4
2529,8,480,508,add parmesan butter and milk to the soup,video_426.mp4
2530,9,558,563,add pepper to the soup,video_426.mp4
2531,0,20,39,drain garbanzo beans,video_427.mp4
2532,1,47,58,juice the lemons,video_427.mp4
2533,2,59,77,slice the jalapeno peppers and remove the seeds,video_427.mp4
2534,3,120,175,add lemon juice oil tahini garlic ground cumin salt and garbanzo beans to the blender,video_427.mp4
2535,4,187,207,add jalapeno peppers cilantro and a little water to the blender,video_427.mp4
2536,5,208,248,put lid on and blend,video_427.mp4
2537,0,27,49,take a bowl and add some olive oil some vinegar dijon mustard and some salt and pepper and mix well,video_428.mp4
2538,1,55,72,take another bowl and add some mayonnaise and 1 lemon juice and mix it well,video_428.mp4
2539,2,90,118,take two apples cut them into corners and take some celery and chop them and take some walnut,video_428.mp4
2540,3,122,134,add apples celery and walnut in a bowl and add the vinegar dressing to it and mix,video_428.mp4
2541,4,143,165,take some lettuce and place it in a bowl put the celery mix on it,video_428.mp4
2542,5,175,180,lastly add the mayonnaise dressing over it,video_428.mp4
2543,0,10,55,remove the fat from a pork chop and cut into pieces,video_429.mp4
2544,1,68,85,add ground ginger and soy sauce to the pork and mix,video_429.mp4
2545,2,87,98,add hoisin sauce to the pork and mix,video_429.mp4
2546,3,150,172,cut carrots into small pieces,video_429.mp4
2547,4,197,220,cut a green onion into small pieces,video_429.mp4
2548,5,233,250,add the pork into a pot of hot oil,video_429.mp4
2549,6,252,260,remove the pork from the pan and place on a plate,video_429.mp4
2550,7,275,291,add chopped garlic and green onions to a pan of hot oil,video_429.mp4
2551,8,293,302,add rice to the pan and stir,video_429.mp4
2552,9,308,320,break an egg into the center of the rice and mix,video_429.mp4
2553,10,330,344,add the pork back into the wok and add the carrots and soy sauce,video_429.mp4
2554,0,20,34,place onions in a pan of hot oil,video_430.mp4
2555,1,40,55,add cashew nuts and raisins to the pan,video_430.mp4
2556,2,60,72,add a paste of spices in the pan,video_430.mp4
2557,3,76,90,add chopped tomatoes to the pan and stir,video_430.mp4
2558,4,93,115,add green peppers and mixed vegetables to the pan,video_430.mp4
2559,5,116,132,add chopped coriander salt and water to the pan,video_430.mp4
2560,6,140,150,add saffron and water to the rice and mix,video_430.mp4
2561,7,165,220,add the rice to a greased bowl along with the vegetables,video_430.mp4
2562,8,221,226,add milk to the top of the rice,video_430.mp4
2563,9,230,248,add the fried onions cashews and raisins to the top,video_430.mp4
2564,0,53,79,add carrots onions celery and green beans to a pot with salt and tomatoes,video_432.mp4
2565,1,124,127,add a piece of parmesan rind to the pot,video_432.mp4
2566,2,143,158,add a bay leaf to the pot and cover,video_432.mp4
2567,3,200,206,add kidney beans to the pot,video_432.mp4
2568,4,222,225,add pasta to the pot,video_432.mp4
2569,5,247,253,add parsley to the pot,video_432.mp4
2570,6,290,334,pour the soup into a bowl and add parmesan cheese and parsley,video_432.mp4
2571,0,19,27,add cut potatoes butter and salt into a bowl,video_434.mp4
2572,1,28,40,mash the potatoes with a masher,video_434.mp4
2573,2,43,50,put half of the potatoes in another bowl and add pepper jack cheese and bacon bits,video_434.mp4
2574,3,51,65,stir the potato mixture with a spoon,video_434.mp4
2575,4,68,76,add garlic powder dried parsley and grated parmesan cheese to the rest of the potatoes,video_434.mp4
2576,5,80,110,use a tablespoon to make balls out of the mashed potatoes,video_434.mp4
2577,6,111,117,place the mashed potato balls onto a baking sheet and place in the fridge,video_434.mp4
2578,7,120,127,crack an egg into a bowl and whisk with a fork,video_434.mp4
2579,8,134,138,coat the mashed potato balls with the beaten egg,video_434.mp4
2580,9,139,150,transfer the mashed potato ball into a bowl with panko bread crumbs and roll it around,video_434.mp4
2581,10,162,171,place the mashed potato balls into a pan of hot oil,video_434.mp4
2582,11,176,186,remove the balls from the oil and place on paper towel to dry,video_434.mp4
2583,12,194,198,poke a skewer in the balls and serve on a plate,video_434.mp4
2584,0,58,66,heat up the oil in the pan,video_435.mp4
2585,1,67,93,fry the pork in the pan,video_435.mp4
2586,2,100,106,add salt to the pork,video_435.mp4
2587,3,113,124,add the cabbage and carrots to the pan,video_435.mp4
2588,4,163,188,add green onions and sesame oil to the pan,video_435.mp4
2589,5,208,223,place the filling towards the top of the wrapper,video_435.mp4
2590,6,226,234,roll the wrapper up halfway,video_435.mp4
2591,7,234,243,fold in the sides and roll up,video_435.mp4
2592,8,243,250,seal the wrapper with egg white,video_435.mp4
2593,9,264,296,fry the egg rolls in a pan,video_435.mp4
2594,10,296,307,flip the egg rolls over,video_435.mp4
2595,11,318,327,drizzle oil on top of the rolls,video_435.mp4
2596,0,8,93,slice the bread and apply olive oil and cheesy sauce on the bread,video_436.mp4
2597,1,102,144,place ham tomatoes salt and pepper on the bread,video_436.mp4
2598,2,151,208,top with grated cheese and olive oil,video_436.mp4
2599,0,80,85,pour little oil on the preheated grill,video_438.mp4
2600,1,87,116,apply butter on one side of the bread season it with salt and pepper and put bread on grill,video_438.mp4
2601,2,117,128,pour little oil on the other side of the bread season with salt and pepper,video_438.mp4
2602,3,140,169,flip the bread and spread cheese on the bread,video_438.mp4
2603,4,185,195,combine 2 slices of bread and let it cook on the grill,video_438.mp4
2604,5,209,216,cut them and serve,video_438.mp4
2605,0,25,51,add some salt to boiling water and add some potato chunks,video_442.mp4
2606,1,53,64,chop some garlic into pieces,video_442.mp4
2607,2,68,77,drain the boiled potatoes in a large bowl,video_442.mp4
2608,3,78,102,add some butter cheese powder and the chopped garlic,video_442.mp4
2609,4,103,132,add sugar and oregano powder and mash the potatoes,video_442.mp4
2610,0,6,25,place lettuce and cucumber in a line on the sheet,video_443.mp4
2611,1,25,41,place the tuna in a line on the sheet,video_443.mp4
2612,2,41,65,roll up the sheet and squeeze the roll,video_443.mp4
2613,3,66,107,slice the roll into pieces,video_443.mp4
2614,0,7,28,add beer lemon juice worcestershire sauce sliced garlic and black pepper to make marinade,video_444.mp4
2615,1,41,81,marinade the meat,video_444.mp4
2616,2,92,140,grill the meat,video_444.mp4
2617,3,167,180,heat up the tortillas,video_444.mp4
2618,4,192,210,dice the meat,video_444.mp4
2619,5,218,246,place guacamole meat sauce onions parsley and lime juice on the tortilla,video_444.mp4
2620,0,53,60,add the flour to the mixer,video_445.mp4
2621,1,61,72,add dried active yeast into water and mix it,video_445.mp4
2622,2,75,77,add salt to the mixer and blend,video_445.mp4
2623,3,93,118,pour the yeast mixture into the mixer,video_445.mp4
2624,4,150,166,roll the dough,video_445.mp4
2625,5,167,173,place the dough in a bowl and cover with a towel,video_445.mp4
2626,6,189,213,uncover the dough and remove the air,video_445.mp4
2627,7,288,294,grate the cheese and cut the bread into slices,video_445.mp4
2628,8,323,351,spread mustard on a bread slice sprinkle grated cheese some oregano powder and black pepper and place a slice on top,video_445.mp4
2629,9,364,389,brush the bread with butter and place the sandwich on the pan,video_445.mp4
2630,0,72,154,add kaffir lime leaves and lemon grass stalks to a pot of stock,video_446.mp4
2631,1,159,168,add few slices of fresh ginger and some chile pepper slices,video_446.mp4
2632,2,179,189,remove the herbs,video_446.mp4
2633,3,190,199,add chicken cherry tomatoes and mushrooms,video_446.mp4
2634,4,222,227,garnish the soup with cilantro leaves,video_446.mp4
2635,0,50,69,cut parsley butter and garlic and add salt,video_448.mp4
2636,1,71,92,mix the butter mixture by hand,video_448.mp4
2637,2,104,109,fill a shell with some of the butter mixture,video_448.mp4
2638,3,110,112,add an escargot to the shell,video_448.mp4
2639,4,113,120,fill the rest of the shell with the butter,video_448.mp4
2640,5,122,125,place the shells in a tray,video_448.mp4
2641,0,44,53,add butter to a hot pan to melt,video_450.mp4
2642,1,54,69,add onions and cook until brown,video_450.mp4
2643,2,70,75,add the cinnamon stick cloves and bay leaf to the pan,video_450.mp4
2644,3,92,103,add garlic paste to pan and stir,video_450.mp4
2645,4,104,109,add bell pepper and tomatoes to pan,video_450.mp4
2646,5,122,145,mix spices into the yogurt,video_450.mp4
2647,6,148,154,add the yogurt mixture to the pan,video_450.mp4
2648,7,162,167,add coriander leaves and sugar to the pan,video_450.mp4
2649,8,176,211,add the cooked rice and vegetables to the pan and mix,video_450.mp4
2650,9,214,220,add salt and water to the pan,video_450.mp4
2651,10,238,240,add more coriander leaves to the pan,video_450.mp4
2652,11,246,252,cover pan with lid,video_450.mp4
2653,12,254,272,remove lid and transfer contents of the pan onto a plate,video_450.mp4
2654,13,273,286,garnish plate with cottage cheese and coriander leaves,video_450.mp4
2655,0,5,15,crush some hazelnut pre roasted in the oven and put them in with the watercress in a bowl,video_451.mp4
2656,1,19,27,add some vinegar toss and mix all together well,video_451.mp4
2657,2,33,48,on a plate arrange thinly sliced apple pieces and place the mixed salad on them,video_451.mp4
2658,3,57,84,cut the foie gras and season with salt and pepper and cook in a hot pan,video_451.mp4
2659,4,94,103,plate the pieces of black pudding along with salad,video_451.mp4
2660,5,128,131,place the cooked foie gras on the salad along with fried potato wedge and serve,video_451.mp4
2661,0,23,71,fill a pan with oyster sauce cooking wine hoisin sauce soy sauce sugar chicken broth vinegar chili sauce sesame oil,video_452.mp4
2662,1,72,94,add minced garlic and ginger to the pan and stir,video_452.mp4
2663,2,108,145,add cooking wine soy sauce an egg and garlic to a bowl of chicken and mix,video_452.mp4
2664,3,153,161,add corn starch to the chicken and mix,video_452.mp4
2665,4,167,172,add vegetable oil to the chicken,video_452.mp4
2666,5,182,195,place the chicken pieces into a pan of hot oil,video_452.mp4
2667,6,197,210,remove the chicken from the oil,video_452.mp4
2668,7,239,260,pour the sauce into a pan and add green onion,video_452.mp4
2669,8,265,271,add corn starch slurry to the sauce and mix,video_452.mp4
2670,9,272,285,add the chicken to the sauce and mix,video_452.mp4
2671,0,49,67,add the spices and curry leaves to the pan,video_453.mp4
2672,1,76,81,grind the ingredients,video_453.mp4
2673,2,86,109,mix the flour with the squid,video_453.mp4
2674,3,125,149,fry the squid in oil in a pan,video_453.mp4
2675,4,153,166,add the garlic onion and curry leaves to oil in pan,video_453.mp4
2676,5,166,169,add the crushed ingredients to the pan,video_453.mp4
2677,6,192,202,stir in the squid,video_453.mp4
2678,0,82,145,peel the skin from the onion and cut the onion into thin slices,video_454.mp4
2679,1,175,179,pour milk on the onions,video_454.mp4
2680,2,230,241,coat the onions in the flour mixture,video_454.mp4
2681,3,241,252,deep fry the onions in the oil,video_454.mp4
2682,4,278,286,sprinkle salt on top of the onions,video_454.mp4
2683,0,27,32,soak beans over night,video_455.mp4
2684,1,33,66,drain water and put in new pot of water and boil,video_455.mp4
2685,2,73,118,chop tomatos into small pieces and put in bowl,video_455.mp4
2686,3,119,131,chop onion into a bowl,video_455.mp4
2687,4,132,170,chop chorizo,video_455.mp4
2688,5,174,186,chop celery,video_455.mp4
2689,6,187,215,add oil to a pan and put in onion and chorizo,video_455.mp4
2690,7,216,255,add celery and salt to pot,video_455.mp4
2691,8,265,285,add tomatos and water to cook,video_455.mp4
2692,9,293,333,add beans into pot and mix,video_455.mp4
2693,10,338,362,add cooked pasta into pot,video_455.mp4
2694,0,91,173,combine sea salt chili flakes and dreidel,video_456.mp4
2695,1,191,212,coarsely chop one head of green cabbage discarding the core,video_456.mp4
2696,2,213,228,transfer the chopped cabbage in to the food processor and grind it,video_456.mp4
2697,3,229,238,transfer it to a big bowl,video_456.mp4
2698,4,239,254,process purple cabbage and transfer it to the big bowl,video_456.mp4
2699,5,262,279,grate the carrots and transfer it to the big bowl,video_456.mp4
2700,6,280,289,add diced onion and garlic to the bowl,video_456.mp4
2701,7,290,321,sprinkle salt and mix thoroughly,video_456.mp4
2702,8,389,412,transfer everything into a pyrex bowl,video_456.mp4
2703,9,413,435,mash it down using a potato masher,video_456.mp4
2704,10,442,465,press down hard using a plate and place a weight,video_456.mp4
2705,11,466,482,cover the bowl,video_456.mp4
2706,0,115,138,pour olive oil on the italian bread cubes and bake them in the oven,video_457.mp4
2707,1,138,205,mix anchovy paste dijon mustard worcestershire sauce lemon juice and minced garlic,video_457.mp4
2708,2,205,244,add olive oil and parmiggiano reggiano to the dressing and mix the ingredients,video_457.mp4
2709,3,244,289,add some pepper and salt to the dressing and mix well,video_457.mp4
2710,4,289,302,add the baked bread cubes to chopped romaine lettuce in a bowl,video_457.mp4
2711,5,302,329,pour the dressing on bread and lettuce and mix the ingredients of the salad together,video_457.mp4
2712,0,3,61,mix ground pork oyster sauce ginger soy sauce sesame oil cabbage green onions and white pepper,video_458.mp4
2713,1,70,77,put a scoop of filling in the center the the wrap,video_458.mp4
2714,2,78,95,apply water in the edges fold it and seal it,video_458.mp4
2715,3,96,113,cook the pierogi wraps in hot boiling water,video_458.mp4
2716,4,114,140,heat oil in a pan and fry the pot stickers,video_458.mp4
2717,0,25,35,mince 2-3 cloves of garlic,video_459.mp4
2718,1,47,58,chop one onion finely,video_459.mp4
2719,2,74,88,heat two tbsp of olive oil in a pot add the chopped onions and saute until the onions are brown,video_459.mp4
2720,3,89,118,add 1 tbsp of hungarian paprika add meat stir until coated with onions and paprika and simmer for 10 minutes,video_459.mp4
2721,4,121,150,add garlic bay leaf salt pepper and add water to cover ingredients and let it simmer for 1 5 hours,video_459.mp4
2722,5,151,178,peel and dice potatoes parsnip and carrots,video_459.mp4
2723,6,179,209,add one tsp of celery seeds chopped potatoes carrots and parsnip into pot add water to cover and simmer,video_459.mp4
2724,7,210,220,slice green and red peppers,video_459.mp4
2725,8,221,248,add sliced peppers into pot add 1 tbsp of tomato paste mix in and cook until thickens and serve,video_459.mp4
2726,0,73,89,spread the rice onto the seaweed,video_460.mp4
2727,1,91,93,flip the seaweed over,video_460.mp4
2728,2,93,103,place the crab and celery on the seaweed in a line,video_460.mp4
2729,3,103,113,roll up and press down with the mat,video_460.mp4
2730,4,126,145,cut the roll into pieces,video_460.mp4
2731,0,117,171,spread shredded muenster cheese cheddar cheese monterey jack and mzzarella cheese on cooked macaroni,video_462.mp4
2732,1,177,192,spread some chopped steamed lobster and sauteed shrimp on the dish,video_462.mp4
2733,2,198,235,pour some melted butter beaten eggs seasoned salt and half-half on the dish,video_462.mp4
2734,3,239,286,mix the pasta and add paprika,video_462.mp4
2735,0,30,33,put a pot of water on the stove and bring it to boil,video_463.mp4
2736,1,40,93,cut the pancetta  italian bacon  into small squares,video_463.mp4
2737,2,120,125,add some salt and spaghetti to the boiling water,video_463.mp4
2738,3,131,155,put a pan on medium heat put olive oil and add cut pancetta and cook it crispy,video_463.mp4
2739,4,161,198,take eggs lightly whisk then add grated parmesan cheese grated pepper thick cream and whisk thoroughly to make sauce,video_463.mp4
2740,5,213,223,put minced garlic to the cooked pancetta and cook for 30 secs,video_463.mp4
2741,6,229,236,take some water from the boiling pasta and keep it aside,video_463.mp4
2742,7,237,259,put the cooked pasta directly into the pan and toss,video_463.mp4
2743,8,260,269,pour cooked pasta into a bowl,video_463.mp4
2744,9,286,305,pour half of hot pasta water into the ready sauce and whisk,video_463.mp4
2745,10,309,338,pour sauce to the pasta in the bowl and toss it around to mix well,video_463.mp4
2746,11,340,344,chop some fresh parsley,video_463.mp4
2747,12,351,379,put ready pasta in a serving bowl sprinkle grated fresh black pepper grated parmesan cheese and garnish with chopped parsley,video_463.mp4
2748,0,25,49,peel and cut the onion into rings,video_467.mp4
2749,1,50,63,add the onion rings into a bowl,video_467.mp4
2750,2,64,83,add water and milk to the bowl,video_467.mp4
2751,3,108,136,pour vegetable oil into a hot pot,video_467.mp4
2752,4,137,147,add flour into a tray,video_467.mp4
2753,5,148,168,pour buttermilk and milk into bowl and stir,video_467.mp4
2754,6,196,240,coat the onions with the flour the buttermilk mixture and with the flour again,video_467.mp4
2755,7,285,298,place the onion rings into the pot of hot oil,video_467.mp4
2756,8,315,334,remove the onion rings from the oil and place on a paper towel,video_467.mp4
2757,9,341,367,season the onion rings with campshake,video_467.mp4
2758,10,455,468,plate the onion rings and serve with blossom sauce,video_467.mp4
2759,0,113,130,add brown sugar to the bacon before frying,video_469.mp4
2760,1,260,291,place the bacon on the bread,video_469.mp4
2761,2,291,300,place tomato on the sandwich,video_469.mp4
2762,3,300,307,place the lettuce on the sandwich,video_469.mp4
2763,4,307,313,spread mayonnaise on the bread and place on top,video_469.mp4
2764,0,28,52,spread butter on the bread,video_470.mp4
2765,1,54,60,place the bread on the pan,video_470.mp4
2766,2,60,66,place the slices on cheese on the bread,video_470.mp4
2767,3,66,67,place the slice of bread on top of the cheese,video_470.mp4
2768,4,69,73,flip the sandwich over in the pan,video_470.mp4
2769,0,123,148,add tomato cucumber spring onion radish and lettuce to the bowl,video_471.mp4
2770,1,150,165,add salt lemon salt and summac powder to the salad,video_471.mp4
2771,2,165,192,add mint pomegranate syrup and oil the salad,video_471.mp4
2772,3,201,211,toss the salad,video_471.mp4
2773,4,226,243,top the salad with crispy bread cheese and pomegranate seeds,video_471.mp4
2774,0,17,29,season the chicken with pepper salt soy sauce and corn starch and mix,video_474.mp4
2775,1,32,57,add corn starch water soy sauce vinegar sesame oil chili paste and hoisin sauce to a bowl and mix,video_474.mp4
2776,2,58,80,pour oil and sesame oil onto a hot pan and add red pepper flakes garlic and ginger and stir,video_474.mp4
2777,3,81,93,add the chicken to the pan and stir,video_474.mp4
2778,4,95,114,add green onion red bell pepper celery and zucchini to the pan and stir,video_474.mp4
2779,5,116,125,add the sauce to the pan and stir,video_474.mp4
2780,6,127,140,add peanuts and green onion to the pan,video_474.mp4
2781,0,99,136,mix flour milk egg baking powder and sugar in a bowl,video_476.mp4
2782,1,165,178,grease the pan with butter,video_476.mp4
2783,2,196,213,pour some batter onto the griddle,video_476.mp4
2784,3,214,225,when bubbles form flip the pancakes,video_476.mp4
2785,4,240,260,move to a plate  and pour maple syrup on top,video_476.mp4
2786,0,6,14,preheat the oven,video_477.mp4
2787,1,40,95,slice mushroom tomato capsicum onion and pepperoni,video_477.mp4
2788,2,114,153,place the toppings on the pizza,video_477.mp4
2789,3,155,156,spread some extra grated cheddar cheese on top,video_477.mp4
2790,4,167,209,cook the pizza in the oven,video_477.mp4
2791,0,10,36,mix an egg worcester sauce mustard ketchip pepper onion bell pepper garlic salt and bread crumbs,video_479.mp4
2792,1,36,51,combine the mixture with ground beef,video_479.mp4
2793,2,51,57,form the meat into a loaf and cook in the oven,video_479.mp4
2794,3,57,72,mix ketchup honey and worcester sauce together,video_479.mp4
2795,4,72,80,add the sauce to the top of the loaf,video_479.mp4
2796,0,27,39,place batter on the pan,video_480.mp4
2797,1,40,72,top the batter with blueberries,video_480.mp4
2798,2,106,107,flip the pancake when the bottom is golden,video_480.mp4
2799,3,127,129,take the pancake out,video_480.mp4
2800,4,150,151,pour honey on top,video_480.mp4
2801,0,24,54,add yogurt lemon juice egg yolks mustard salt sugar pepper and hot sauce to a bowl over a pan,video_481.mp4
2802,1,54,63,whisk the sauce while it cooks,video_481.mp4
2803,2,65,77,add salt and vinegar to boiling water,video_481.mp4
2804,3,78,99,add the eggs to the water,video_481.mp4
2805,4,95,101,place salmon on the toast,video_481.mp4
2806,5,102,105,place an egg on the salmon,video_481.mp4
2807,6,105,123,pour the sauce on the toast and garnish with parsley and capers,video_481.mp4
2808,0,57,105,clean and rinse canned escargots and pat them dry and later wash the hands,video_482.mp4
2809,1,111,171,mash some softened butter in a bowl and add 2-3 minced garlic to it,video_482.mp4
2810,2,173,192,add 1  tbsp of finely chopped chives little salt and white pepper,video_482.mp4
2811,3,198,247,mix all the ingredients well by adding little bit of sherry cooking wine until the mixture reaches proper consistency,video_482.mp4
2812,4,255,305,put small dollop of the mixture into the escargot baking dish,video_482.mp4
2813,5,309,333,place one escargot over each of the dollops of mixture and pop them in,video_482.mp4
2814,6,337,382,take the rest of the butter mixture and put them on top of escargots,video_482.mp4
2815,7,384,400,place the dishes on a cooking sheet and put them in the preheated oven at 350-degree c for 15-18 minutes,video_482.mp4
2816,8,402,422,remove the cooked escargots and serve them in the escargot baking dish itself,video_482.mp4
