,id,start_frame,stop_frame,annotation,video_file
7727,1,36,61,peel and cut the potatos,video_1337.mp4
7728,2,61,72,add the potatos and cold water to a pot,video_1337.mp4
7729,3,73,82,add salt to the pot,video_1337.mp4
7730,4,129,143,drain the potatos,video_1337.mp4
7731,5,174,228,mash the potatos and butter,video_1337.mp4
7732,6,229,267,mix the potatos with milk and cream,video_1337.mp4
7733,7,267,276,add black pepper to the mashed potatos,video_1337.mp4
7734,8,287,294,chop up the chives and add to the mashed potatos,video_1337.mp4
7735,0,17,22,cut the chicken into pieces,video_1338.mp4
7736,1,22,38,season the chicken with salt pepper and garlic powder,video_1338.mp4
7737,2,38,90,add yogurt and milk to bowl of chicken,video_1338.mp4
7738,3,114,155,mix flour salt garlic powder black pepper and cayenne pepper,video_1338.mp4
7739,4,155,199,coat the chicken with the flour mixture,video_1338.mp4
7740,5,200,214,place the chicken in the pot of oil,video_1338.mp4
7741,0,40,68,add egg yolk dijon mustard anchovies garlic minced and lemon juice to a mixer and blend,video_1341.mp4
7742,1,69,74,add olive oil,video_1341.mp4
7743,2,79,103,fry some bacon in a pan until crispy and drain it on a paper towel,video_1341.mp4
7744,3,105,129,lay bacon and tomatoes on the bread,video_1341.mp4
7745,4,133,158,pour some caesar dressing on top of tomatoes place and top with lettuce and bread,video_1341.mp4
7746,0,15,60,slice the bread loaf and butter the bread on both side of the slices,video_1342.mp4
7747,1,84,102,grate the cheddar cheese and the gruyere cheese,video_1342.mp4
7748,2,112,120,sprinkle mixed grated irish cheddar and gruyere cheese on one piece and top with a bread slice,video_1342.mp4
7749,3,126,139,spread hot sauce on one bread slice and add the grated cheese and top it with a bread slice,video_1342.mp4
7750,4,141,154,place a slice of ham sprinkle grated cheese mixture and top it with a bread slice,video_1342.mp4
7751,5,163,186,toast all the sandwiches on a griddle pan,video_1342.mp4
7752,0,49,104,mix the potato egg onion flour salt and pepper together,video_1343.mp4
7753,1,126,131,heat up oil in a skillet,video_1343.mp4
7754,2,132,157,place dollops of the potato mixture in the pan,video_1343.mp4
7755,3,168,178,flip the potato cakes over,video_1343.mp4
7756,4,185,206,take the cakes out of the pan and drain them on paper towel,video_1343.mp4
7757,0,23,30,add macaroni to a bowl,video_1345.mp4
7758,1,34,46,add an egg onion and carrot to the bowl,video_1345.mp4
7759,2,46,55,add salt and dressing to the bowl,video_1345.mp4
7760,3,55,72,toss the salad,video_1345.mp4
7761,0,35,45,wash the urad daal and kidney beans then cook them to a boil,video_1348.mp4
7762,1,47,60,add some mixed spice and a little salt and let it cook for 1 hour,video_1348.mp4
7763,2,84,100,heat some oil in a pan until hot,video_1348.mp4
7764,3,102,115,add ginger garlic paste to the pan and give a saute,video_1348.mp4
7765,4,120,139,also add red chili powder cumin powder and coriander powder and cook a littl bit,video_1348.mp4
7766,5,144,175,add fresh made tomato puree and leave it to simmer,video_1348.mp4
7767,6,179,218,put the daal to the pan and give a stir,video_1348.mp4
7768,7,204,235,put some cream and butter to the pan,video_1348.mp4
7769,8,240,268,stir while cooking until it is ready to serve,video_1348.mp4
7770,0,110,120,preheat pan with oil,video_1350.mp4
7771,1,121,129,scramble 4 eggs in a bowl with soy sauce and add to pan,video_1350.mp4
7772,2,130,185,stir and chop eggs in pan until fully cooked,video_1350.mp4
7773,3,186,198,remove eggs and place in a bowl,video_1350.mp4
7774,4,205,252,add oil garlic ginger carrots celery and onion to the pan,video_1350.mp4
7775,5,292,350,add meat and mix,video_1350.mp4
7776,6,358,397,add bag of cooked rice and mix well,video_1350.mp4
7777,7,400,467,add frozen peas and eggs and mix,video_1350.mp4
7778,8,468,525,add soy sauce and mix and a teaspoon of sugar,video_1350.mp4
7779,0,690,694,rinse quinoa in water,video_1351.mp4
7780,1,701,710,bring 2 cups of water to a boil on stove,video_1351.mp4
7781,2,711,717,add quinoa and cover and reduce heat,video_1351.mp4
7782,3,758,765,cut off ends of parsley stalks,video_1351.mp4
7783,4,770,796,squeeze parsley leaves chop into small pieces and add to bowl,video_1351.mp4
7784,5,797,828,slice onion into disks then cut in half and add to bowl,video_1351.mp4
7785,6,830,861,cut tomatos into diced pieces and add to bowl,video_1351.mp4
7786,7,865,893,roll lemon on cutting board and cut and remove seeds,video_1351.mp4
7787,8,894,896,squeeze juice into bowl,video_1351.mp4
7788,9,896,920,add 2 table spoons of oil,video_1351.mp4
7789,10,922,934,add sea salt to bowl,video_1351.mp4
7790,11,952,967,add black pepper and cayenne pepper,video_1351.mp4
7791,12,1014,1046,add quinoa mix and serve,video_1351.mp4
7792,0,45,73,cook onion and lamb in a pan,video_1352.mp4
7793,1,140,150,add flour to the pan of meat,video_1352.mp4
7794,2,176,207,add the water to the bouillon cube and add that to the pan,video_1352.mp4
7795,3,237,252,add salt and pepper to the pan,video_1352.mp4
7796,4,260,310,transfer the contents of the pan to a dish,video_1352.mp4
7797,5,320,330,add a layer of vegetables to the dish,video_1352.mp4
7798,6,350,380,add milk salt and pepper to the potatos,video_1352.mp4
7799,7,380,398,add butter to the potatos and mash them,video_1352.mp4
7800,8,400,480,layer the mashed potatos in the dish,video_1352.mp4
7801,9,520,535,bake the dish in the oven,video_1352.mp4
7802,0,15,20,mix milk with vinegar,video_1353.mp4
7803,1,28,40,mix butter sugar and an egg in a bowl,video_1353.mp4
7804,2,40,86,mix in flour baking powder baking soda salt and buttermilk,video_1353.mp4
7805,3,104,120,pour batter onto the pan,video_1353.mp4
7806,4,120,134,flip the pancake when bubbles form,video_1353.mp4
7807,0,35,70,add sriracha to a bowl with tuna kimchi sauce sesame oil mayonnaise and mix well,video_1355.mp4
7808,1,78,118,place rice and seseame seeds avocado and tuna on seaweed and roll up,video_1355.mp4
7809,2,136,162,put the spicy mixture on the roll and cover it with a cling wrap to keep it together,video_1355.mp4
7810,3,167,232,cut the roll and top with spicy mayonnaise flakes and scallions,video_1355.mp4
7811,0,39,43,finely chop the onions garlic and carrots,video_1356.mp4
7812,1,44,54,cook the chopped bacon in a pan and add ground beef,video_1356.mp4
7813,2,55,62,add the onion garlic and carrot to a pan of olive oil over heat,video_1356.mp4
7814,3,63,68,pour red wine into the pan and add two sprigs of rosemary,video_1356.mp4
7815,4,69,75,add the bacon and ground beef to the pan and mix,video_1356.mp4
7816,5,76,81,add the tomato paste crushed tomatoes tomato puree and beef stock to the pan,video_1356.mp4
7817,6,88,92,add balsamic vinegar and salt to the pan,video_1356.mp4
7818,7,102,107,slice a potato into cubes and cook in salted boiling water,video_1356.mp4
7819,8,108,113,strain the potatoes and add to a pot and crush,video_1356.mp4
7820,9,114,121,add warm milk to the potatoes while mashing the potatoes,video_1356.mp4
7821,10,125,143,spread the mashed potato over the meat sprinkle with paprika and garnish with rosemary,video_1356.mp4
7822,11,144,147,bake the pie in an oven,video_1356.mp4
7823,0,32,68,melt butter in a pan add 1 tbsp of all purpose flour whisk it and cook,video_1357.mp4
7824,1,69,115,add milk white pepper salt nutmeg mix and cook,video_1357.mp4
7825,2,116,130,add grated cheddar cheese turn off the heat and stir,video_1357.mp4
7826,3,134,213,place toasted breads on a baking tray and put mustard and ham on top,video_1357.mp4
7827,4,214,238,put some grated swiss cheese on top and cover the top with another mustard applied toast,video_1357.mp4
7828,5,244,303,pour some cheese sauce  bechamel  grated cheese and herbs de provence,video_1357.mp4
7829,6,304,317,bake it in ovens,video_1357.mp4
7830,0,75,87,peel a carrot into thin strips,video_1359.mp4
7831,1,96,102,place the beef into a hot pan of oil,video_1359.mp4
7832,2,106,113,add the carrot strips into the pan,video_1359.mp4
7833,3,115,123,add mushroom and water to the pan,video_1359.mp4
7834,4,124,131,cook the spinach on the pan,video_1359.mp4
7835,5,138,144,spread oil onto the bottom of a clay pot,video_1359.mp4
7836,6,147,155,place claypot rice beef carrots spinach and mushrooms in the pot,video_1359.mp4
7837,7,156,168,break an egg and add the yolk to the pot,video_1359.mp4
7838,8,220,225,add chili paste to the bibimbap and stir,video_1359.mp4
7839,0,89,123,dice the tofu,video_1360.mp4
7840,1,129,189,combine soy sauce garlic chili paste oyster sauce salt sugar pepper green onions and water and stir,video_1360.mp4
7841,2,194,209,spread oil in a frying pan,video_1360.mp4
7842,3,211,240,fry ground pork,video_1360.mp4
7843,4,241,256,add minced garlic stir and cook,video_1360.mp4
7844,5,257,276,add sesame oil and stir,video_1360.mp4
7845,6,277,355,add diced tofu and sauce,video_1360.mp4
7846,7,340,354,add the corn starch and cook,video_1360.mp4
7847,8,356,371,add chopped green onions and mix together,video_1360.mp4
7848,0,7,19,soak the rice noodles in warm water,video_1362.mp4
7849,1,20,55,mix tamarind water palm sugar and fish sauce,video_1362.mp4
7850,2,56,80,cook the sauce outdoors with lid on,video_1362.mp4
7851,3,85,104,add chopped garlic peanut oil and marinated shrimp and stir fry until cooked,video_1362.mp4
7852,4,105,176,add the noodles water sauce chili paste  and paprika to the wok and toss,video_1362.mp4
7853,5,177,210,add the shrimp into the noodles crack in some eggs and stir fry to combine,video_1362.mp4
7854,6,211,223,add fresh bean sprouts and serve it,video_1362.mp4
7855,0,45,58,cut the piece of nori in half and place on top of the bamboo roller,video_1363.mp4
7856,1,62,84,mix the crab meat and mayonnaise together,video_1363.mp4
7857,2,94,114,spread a ball of rice onto the nori,video_1363.mp4
7858,3,117,132,spread tobiko on the rice and flip over,video_1363.mp4
7859,4,133,140,spread the crab meat along the center,video_1363.mp4
7860,5,143,171,cut the avocado into slices and lay down next to the crab meat,video_1363.mp4
7861,6,172,198,roll up and press in the sides,video_1363.mp4
7862,0,54,84,heat a pan add 1 spoon oil and prosciutto to it,video_1365.mp4
7863,1,86,117,add onions butter chopped parsley and salt to it and keep stirring,video_1365.mp4
7864,2,146,150,pull the pan off fire and add some vodka,video_1365.mp4
7865,3,155,186,wait for the flame off and add marinara sauce and some cream to the pan and cook for some seconds,video_1365.mp4
7866,4,237,333,strain some boiled pasta pour the sauce on it and garnish with parmesan cheese,video_1365.mp4
7867,0,73,81,cut the tortilla into four pieces,video_1366.mp4
7868,1,85,112,spread the beans on the tortilla,video_1366.mp4
7869,2,113,122,roll the tortilla up,video_1366.mp4
7870,3,122,132,insert a toothpick into the burrito,video_1366.mp4
7871,4,137,150,place the burritos in the fryer,video_1366.mp4
7872,5,150,166,fry the burritos until golden,video_1366.mp4
7873,6,173,181,remove the toothpick from the burritos,video_1366.mp4
7874,0,154,180,add black pepper sesame oil garlic green onions and sesame seeds to a bowl of bean sprouts,video_1368.mp4
7875,1,209,223,add sesame oil garlic green onions sesame seeds salt and pepper to a bowl of spinach,video_1368.mp4
7876,2,261,303,add radish to a pan of hot oil with salt pepper garlic green onion sesame seeds and soy sauce,video_1368.mp4
7877,3,314,351,add mushroom salt pepper soy sauce garlic and green onion to a hot pan,video_1368.mp4
7878,4,443,447,add bulgogi to a hot pan,video_1368.mp4
7879,5,491,507,add sesame oil sesame seeds and sugar to a bowl of red pepper paste and mix,video_1368.mp4
7880,0,16,28,heat some oil in a pan and cook minced beef,video_1369.mp4
7881,1,29,34,add some chopped carrots and onions and cook,video_1369.mp4
7882,2,37,50,add the beef water and a stock cube and simmer,video_1369.mp4
7883,3,56,70,add some tomato ketchup and worcestershire sauce and stir,video_1369.mp4
7884,4,75,94,add some milk mustard and some grated cheese and mash,video_1369.mp4
7885,5,99,108,mix cornstarch with water and pour it into the gravy,video_1369.mp4
7886,6,109,112,once the gravy thickens take it off the heat and pour it to a baking dish,video_1369.mp4
7887,7,115,120,spread the mashed potatoes over the gravy evenly and scour using a fork,video_1369.mp4
7888,8,123,138,sprinkle rest of the cheese on the top and place the dish in the oven,video_1369.mp4
7889,0,44,69,chop carrot celery onion and garlic,video_1372.mp4
7890,1,70,95,add all vegetables into pot with oil and a pinch of salt,video_1372.mp4
7891,2,95,97,add ground lamb to pot,video_1372.mp4
7892,3,124,158,peal potatos and chop into chunks,video_1372.mp4
7893,4,160,180,put potatos into cold salted water and bring to boil,video_1372.mp4
7894,5,186,222,add lamb stock tomato puree and lea and perrins and warm water,video_1372.mp4
7895,6,241,246,add meat mixture to baking dish,video_1372.mp4
7896,7,248,262,mash potatos with milk and butter and salt,video_1372.mp4
7897,8,266,273,cover meat with mashed potatos,video_1372.mp4
7898,9,274,291,add blue cheese and put in oven,video_1372.mp4
7899,0,90,100,crack two eggs into a bowl,video_1374.mp4
7900,1,105,118,add flour to the bowl,video_1374.mp4
7901,2,120,140,stir the contents of the bowl,video_1374.mp4
7902,3,146,170,add spices to the bowl,video_1374.mp4
7903,4,200,244,dip shrimp into the batter and breadcrumbs and put into pan with hot oil,video_1374.mp4
7904,0,64,76,prepare some dried chickpeas and soak them with water overnight,video_1375.mp4
7905,1,76,90,rmove water put the chickpeas into a food processor,video_1375.mp4
7906,2,94,148,add chopped onions garlic cilantro red chili cumin salt pepper baking soda and lemon juice,video_1375.mp4
7907,3,149,188,mix a little bit and blend everything together,video_1375.mp4
7908,4,207,247,take out the mixture seal for 2 hours and then shape it to balls,video_1375.mp4
7909,5,253,274,deep fry the balls in oil to serve,video_1375.mp4
7910,0,127,161,grate one piece of chicken,video_1377.mp4
7911,1,177,240,chop ginger garlic cilantro,video_1377.mp4
7912,2,241,264,combine ingredients with soy sauce in a bowl,video_1377.mp4
7913,3,266,330,form meat into balls and fry in a pan,video_1377.mp4
7914,4,332,345,combine vinegar soy sauce and salt in a bowl,video_1377.mp4
7915,5,347,395,shave vegetables into the sauce bowl and mix together,video_1377.mp4
7916,6,409,416,slice the bread,video_1377.mp4
7917,7,419,467,place the meatballs vegetables and sauce onto the bread,video_1377.mp4
7918,0,93,118,grind chickpeas soaked overnight along with parsley garlic and cilantro,video_1378.mp4
7919,1,123,144,add cumin baking soda flour and salt to the ground mixture and mix well,video_1378.mp4
7920,2,201,215,mix sesame paste water lemon juice and salt to prepare tahini sauce,video_1378.mp4
7921,3,232,243,add diced cucumbers chopped tomatoes and onions in a large bowl and mix them all well,video_1378.mp4
7922,4,248,301,heat oil shape the falafel and place it in the oil,video_1378.mp4
7923,5,306,337,put falafel salad and tahini sauce into the pita bread and serve,video_1378.mp4
7924,0,125,293,put mayonnaise parmesan lemon juice worcestershire sauce olive oil mustard anchovy paste garlic pepper salt and sugar in the food processor,video_1379.mp4
7925,1,300,306,blend all the ingredients together in the food processor,video_1379.mp4
7926,2,346,349,pour the dressing on the chopped romaine lettuce leaves in a bowl,video_1379.mp4
7927,3,349,360,add some croutons to the bowl and toss the salad,video_1379.mp4
7928,0,40,50,chop the pancetta into chunks,video_1381.mp4
7929,1,62,64,cook the spaghetti,video_1381.mp4
7930,2,71,92,fry the pancetta in pan with garlic and parsely,video_1381.mp4
7931,3,99,106,add the spaghetti to the pan,video_1381.mp4
7932,4,107,116,add a little bit of cooking water from the pasta,video_1381.mp4
7933,5,117,136,whisk eggs and add with cheese to the pasta,video_1381.mp4
7934,0,51,71,toss some brussel sprouts with 1 tbsp of extra virgin olive oil and sprinkle some kosher salt on it,video_1383.mp4
7935,1,71,73,put the brussel sprouts in the oven,video_1383.mp4
7936,2,73,116,coat the thinly pounded chicken breasts with whole wheat flour egg and bread crumbs,video_1383.mp4
7937,3,116,125,bake the chicken breasts in the oven for 6 minutes at high heat,video_1383.mp4
7938,4,125,163,put some pesto sauce tomato sauce minced basil and sage leaves on the baked chicken,video_1383.mp4
7939,5,163,174,put some parmesan cheese and mozzarella cheese on the chicken,video_1383.mp4
7940,6,174,187,bake the chicken for more 6 to 8 minutes in the oven,video_1383.mp4
7941,7,187,219,put some naturally dried cranberries on the brussel sprouts and add some grated parmesan cheese to the mixture,video_1383.mp4
7942,0,53,90,spread the dough out on the pan,video_1384.mp4
7943,1,92,104,place the string cheese on the edges of the dough,video_1384.mp4
7944,2,104,114,fold the dough over the cheese,video_1384.mp4
7945,3,131,182,cut the edges and flip the crust over,video_1384.mp4
7946,4,185,216,spread the sauce on the dough,video_1384.mp4
7947,5,226,247,add mozzerella cheese on top of the sauce,video_1384.mp4
7948,6,260,295,place pepperoni on top of the pizza,video_1384.mp4
7949,7,296,299,bake the pizza in the oven,video_1384.mp4
7950,8,300,320,brush the crust with melted butter,video_1384.mp4
7951,9,320,328,sprinkle garlic powder on the crust,video_1384.mp4
7952,0,32,39,heat oil in the deep fryer,video_1385.mp4
7953,1,39,55,cut the onion into slices and separate the rings,video_1385.mp4
7954,2,57,72,add flour baking powder salt to a dish,video_1385.mp4
7955,3,73,81,coat the onions in the flour mixture,video_1385.mp4
7956,4,84,101,mix milk and an egg with the flour,video_1385.mp4
7957,5,101,114,coat the onion rings in the batter,video_1385.mp4
7958,6,120,138,coat the onion rings with the bread crumbs,video_1385.mp4
7959,7,142,157,deep fry the onion rings,video_1385.mp4
7960,0,65,75,add pasta and salt to a pot of boiling water,video_1387.mp4
7961,1,80,97,add milk and butter to a hot pan,video_1387.mp4
7962,2,104,127,after the butter melts add mayo salt and paprika,video_1387.mp4
7963,3,130,160,add cheese and stir,video_1387.mp4
7964,4,161,179,pour the cheese sauce onto the macaroni and then pour into a pan,video_1387.mp4
7965,5,184,213,add shredded cheese and paprika on top,video_1387.mp4
7966,6,214,226,place the pan in the oven and bake,video_1387.mp4
7967,0,50,56,combine the pork carrots onions and shrimp,video_1388.mp4
7968,1,56,62,mix the sugar garlic salt and ground pepper,video_1388.mp4
7969,2,62,80,mix the seasoning with the filling,video_1388.mp4
7970,3,116,122,place the filling on the wrapper,video_1388.mp4
7971,4,122,138,wrap up the spring roll,video_1388.mp4
7972,5,202,222,deep fry the spring rolls in the oil,video_1388.mp4
7973,0,69,80,boil the noodles in boiled water,video_1389.mp4
7974,1,84,107,drain the noodles and cool them with cold water,video_1389.mp4
7975,2,110,119,cut shrimp and mix it with pork,video_1389.mp4
7976,3,120,134,add onion minced garlic oyster sauce sesame oil salt sugar and black pepper,video_1389.mp4
7977,4,136,140,mix the ingredients well together,video_1389.mp4
7978,5,141,176,wrap the mixture in wonton wrappers,video_1389.mp4
7979,6,187,211,boil the wontons in boiled water,video_1389.mp4
7980,7,221,230,cook some garlic with vegetable oil,video_1389.mp4
7981,8,233,268,boil some onion chunks and baby boy chok in chicken stock with water,video_1389.mp4
7982,9,274,298,put the noodles wonton roasted pork the vegetables and soup to serve,video_1389.mp4
7983,0,0,74,cook beef in a pan,video_1390.mp4
7984,1,107,136,add the seasoning to the beef,video_1390.mp4
7985,2,269,276,put the sauce on the taco,video_1390.mp4
7986,0,19,25,peel and chop shred the potatoes,video_1391.mp4
7987,1,30,43,grate the potatoes aside to dry,video_1391.mp4
7988,2,51,60,grate an onion and add to the potatoes,video_1391.mp4
7989,3,61,68,mix them with hand to combine them well,video_1391.mp4
7990,4,70,81,squeeze the mixture to make the water out,video_1391.mp4
7991,5,94,112,add a tbsp of flour an egg salt and pepper,video_1391.mp4
7992,6,113,123,add a tbsp of garlic powder and mix everthing,video_1391.mp4
7993,7,124,138,add oil to a preheated pan and add the mixture to it,video_1391.mp4
7994,8,139,176,flat the mixture into a patty and fry for 4 minutes,video_1391.mp4
7995,0,45,90,mix flour and butter milk together,video_1392.mp4
7996,1,100,123,mix salt pepper and paprika with the bread crumbs,video_1392.mp4
7997,2,136,160,coat the onion in the batter and the bread crumbs,video_1392.mp4
7998,3,182,193,bake the onion rings in the oven,video_1392.mp4
7999,4,193,210,flip the onion rings over and bake in the oven,video_1392.mp4
8000,0,41,45,add oil to a pan,video_1393.mp4
8001,1,52,58,grate the garlic,video_1393.mp4
8002,2,61,92,add coriander red pepper and onion powder to the pan,video_1393.mp4
8003,3,93,105,add sugar vinegar and garlic to the pan,video_1393.mp4
8004,4,108,116,add tofu to the pan,video_1393.mp4
8005,5,123,129,add broth to the pan,video_1393.mp4
8006,6,152,157,cook the noodles in a pot of boiling water,video_1393.mp4
8007,7,159,166,add cabbage and carrots to the pan,video_1393.mp4
8008,8,181,190,slice the basil,video_1393.mp4
8009,9,198,205,add the noodles to the pan,video_1393.mp4
8010,10,205,223,add salt and worcestershire sauce and stir,video_1393.mp4
8011,11,229,240,juice a lime,video_1393.mp4
8012,12,248,260,top with sprouts peanuts and basil,video_1393.mp4
8013,0,10,36,make a groove inside the hot dog using a clay tool,video_1394.mp4
8014,1,48,60,stuff the hot dog,video_1394.mp4
8015,2,71,86,wrap each hot dog with bacon,video_1394.mp4
8016,3,107,115,place the hot dogs on the grill,video_1394.mp4
8017,0,33,45,put flour and corn flour into a mixing bowl,video_1395.mp4
8018,1,67,77,add some red chili powder and oregano to the bowl,video_1395.mp4
8019,2,78,85,mix the ingredients in the bowl,video_1395.mp4
8020,3,85,110,add some club soda to the bowl and whisk,video_1395.mp4
8021,4,112,120,dip the rings into the batter,video_1395.mp4
8022,5,125,137,put the rings into the fryer one by one,video_1395.mp4
8023,6,139,145,flip the onion rings over,video_1395.mp4
8024,7,150,160,remove the rings from the fryer,video_1395.mp4
8025,0,56,89,add buttermilk egg salt and hot sauce and whisk,video_1396.mp4
8026,1,90,111,add chicken to the mixture,video_1396.mp4
8027,2,127,129,whisk the flour mixture,video_1396.mp4
8028,3,146,156,add salt paprika cayenne pepper onion garlic chili powder ground seed coriander and black pepper to the flour and mix well,video_1396.mp4
8029,4,157,174,coat the chicken in the flour mixture,video_1396.mp4
8030,5,176,184,dip the coated chicken in the buttermilk and the flour,video_1396.mp4
8031,6,194,204,heat vegetable oil in skillet,video_1396.mp4
8032,7,205,255,fry the chicken,video_1396.mp4
8033,8,256,264,drain the chicken,video_1396.mp4
8034,0,62,107,chop some cabbage to small slices,video_1397.mp4
8035,1,142,272,add some salt and massage the cabbage,video_1397.mp4
8036,2,307,347,put the cabbage and the juice in a jar,video_1397.mp4
8037,3,362,365,seal the jar,video_1397.mp4
8038,0,74,88,heat the oil and onions in pan,video_1398.mp4
8039,1,90,100,add some ground beef and salt,video_1398.mp4
8040,2,119,121,add minced garlic,video_1398.mp4
8041,3,132,147,add tomato sauce oregano and ground cumin to the cooked meat and mix them together,video_1398.mp4
8042,4,172,186,heat oil in a pan,video_1398.mp4
8043,5,187,217,fry and the tortilla and soak the oil,video_1398.mp4
8044,6,242,272,put the cooked meat and some sliced avocado tomato sour cream and cheese inside the tortilla,video_1398.mp4
8045,0,30,41,add salt pepper oil and lemon juice to the grapes,video_1399.mp4
8046,1,47,53,bake the grapes in the oven,video_1399.mp4
8047,2,56,60,add walnuts to the baking sheet and bake in the oven,video_1399.mp4
8048,3,60,92,chop the celery,video_1399.mp4
8049,4,92,112,slice the lettuce,video_1399.mp4
8050,5,136,154,mix oil yougurt mustard salt pepper and lemon juice,video_1399.mp4
8051,6,166,170,chop taragon and mix into the dressing,video_1399.mp4
8052,7,170,174,pour the dressing on the salad,video_1399.mp4
8053,8,174,225,add the grapes and crushed nuts to the salad,video_1399.mp4
8054,9,227,235,slice an apple and add to the salad,video_1399.mp4
8055,0,15,60,cut salmon and tuna into small slices,video_1400.mp4
8056,1,75,110,cut a piece of salmon and tuna into thin slices,video_1400.mp4
8057,2,120,126,press a slice of tuna into a ball of rice,video_1400.mp4
8058,3,142,150,press a slice of salmon into a ball of rice,video_1400.mp4
8059,4,154,160,place the sushi onto a plate,video_1400.mp4
8060,0,19,38,peel the potatoes and grate into a bowl of water,video_1401.mp4
8061,1,39,85,rinse drain and dry the potatoes,video_1401.mp4
8062,2,85,120,add clarified butter to the pan and then the potatoes,video_1401.mp4
8063,3,120,149,add salt cayenne pepper black pepper and paprika,video_1401.mp4
8064,4,149,196,stir a bit and cook until browned and crust forms,video_1401.mp4
8065,0,20,24,preheat the oven and grease a pan,video_1402.mp4
8066,1,26,49,add butter salt and pepper onion cream of chicken soup and cheese to bowl of hashbrowns,video_1402.mp4
8067,2,50,58,mix and transfer to a pan,video_1402.mp4
8068,3,60,64,cook in the oven until browned on top,video_1402.mp4
8069,0,137,153,sprinkle salt on the pork and rub the salt in,video_1403.mp4
8070,1,170,178,add the pork ginger and green onion to the pot of water,video_1403.mp4
8071,2,185,192,strain the liquid from the pot,video_1403.mp4
8072,3,192,210,add soy sauce sake salt and sesame oil to the broth,video_1403.mp4
8073,4,215,222,cut up the green onion and pork,video_1403.mp4
8074,5,222,237,add baking soda and noodles to the pot of water,video_1403.mp4
8075,6,254,260,pour the soup over the noodles,video_1403.mp4
